{
  "base_commit": "5f52afe465e55801597a8ab562d76d24061e3133",
  "branch": "codex/repository-hygiene",
  "classification_input_sha256": "294ae375b76576c37cae7c3e9d03ed09745f3d0ebba07696bdaf84bcda4c71dc",
  "generated_at": "2026-09-01T13:19:00Z",
  "main_tree_unchanged": true,
  "manifest_id": "phase-02-critical",
  "manifest_ref": ".ai/mutations/phase-02-critical-manifest.json",
  "manifest_sha256": "1dac9624e5a221784d56dc189e5bb225662334b550238b13ecf7587c96d277c0",
  "mutation_evidence_sha256": "1da4eb49db7a9af2f52f4dc1c639ff5ccef8334406be44b92b1ec2549e4f1565",
  "policy_sha256": "1f684f4bf4bd2e3c28b7a04903628790f7be40f88a1dbf54587b09b90230267f",
  "record_id": "MUTRUN-20260901T131900Z-deba91f69e4d39c5",
  "repository_id": "b85e5a53-4935-4436-bdbc-c26a241bfae8",
  "results": [
    {
      "baseline_exit_code": 0,
      "duration_ms": 828,
      "expected_detector": "tests/unit/test_policy.py::test_v2_policy_requires_ordered_semantic_prefix_and_fixed_required_extras",
      "expected_outcome": "killed",
      "log_ref": ".ai/tasks/TASK-0032/logs/MUTRUN-20260901T131900Z-deba91f69e4d39c5/targeted-mutation/logs/MUT-V2-001.json",
      "log_sha256": "de8cc1d04aa6fd18fd5de3fb2acc0903b19c79abe3fc525ac25fb576e3518e61",
      "mutant_exit_code": 1,
      "mutation_id": "MUT-V2-001",
      "operator": "drop_targeted_mutation_required_check",
      "outcome": "killed",
      "reason_code": null,
      "safeguard_id": "V2_REQUIRED_CHECK_SET",
      "target": "src/aiflow/policy.py",
      "target_symbol": "_validate_cross_file",
      "timed_out": false
    },
    {
      "baseline_exit_code": 0,
      "duration_ms": 6922,
      "expected_detector": "tests/integration/test_verify_command.py::test_v2_actor_rejections_happen_before_plan_or_runner",
      "expected_outcome": "killed",
      "log_ref": ".ai/tasks/TASK-0032/logs/MUTRUN-20260901T131900Z-deba91f69e4d39c5/targeted-mutation/logs/MUT-V2-002.json",
      "log_sha256": "5729918a943c588676311df09e82a6ab2ef0c5d1facf2c3b7b1aa2f58c487122",
      "mutant_exit_code": 1,
      "mutation_id": "MUT-V2-002",
      "operator": "allow_same_verifier_actor",
      "outcome": "killed",
      "reason_code": null,
      "safeguard_id": "V2_VERIFIER_INDEPENDENCE",
      "target": "src/aiflow/verifier_service.py",
      "target_symbol": "validate_verifier_actor",
      "timed_out": false
    },
    {
      "baseline_exit_code": 0,
      "duration_ms": 969,
      "expected_detector": "tests/integration/test_mutation_manifest_contract.py::test_v2_code_approval_rejects_nonpassing_required_check",
      "expected_outcome": "killed",
      "log_ref": ".ai/tasks/TASK-0032/logs/MUTRUN-20260901T131900Z-deba91f69e4d39c5/targeted-mutation/logs/MUT-V2-003.json",
      "log_sha256": "bd50576011d2008283fce989a74512020f085da0c7225a3d37c986865432fea3",
      "mutant_exit_code": 1,
      "mutation_id": "MUT-V2-003",
      "operator": "allow_nonpassing_required_check",
      "outcome": "killed",
      "reason_code": null,
      "safeguard_id": "V2_CODE_APPROVAL_REQUIRES_PASSING_EVIDENCE",
      "target": "src/aiflow/approval.py",
      "target_symbol": "_v2_evidence_current",
      "timed_out": false
    },
    {
      "baseline_exit_code": 0,
      "duration_ms": 937,
      "expected_detector": "tests/integration/test_mutation_manifest_contract.py::test_v2_gate_rejects_non_killed_mutation",
      "expected_outcome": "killed",
      "log_ref": ".ai/tasks/TASK-0032/logs/MUTRUN-20260901T131900Z-deba91f69e4d39c5/targeted-mutation/logs/MUT-V2-004.json",
      "log_sha256": "e732b7309d74049fbb189619c96c6f2c7a50018d5ecc2d746a6e5984a047ded3",
      "mutant_exit_code": 1,
      "mutation_id": "MUT-V2-004",
      "operator": "accept_non_killed_mutation",
      "outcome": "killed",
      "reason_code": null,
      "safeguard_id": "V2_GATE_REQUIRES_KILLED_MUTATIONS",
      "target": "src/aiflow/gate.py",
      "target_symbol": "_v2_gate_facts",
      "timed_out": false
    },
    {
      "baseline_exit_code": 0,
      "duration_ms": 812,
      "expected_detector": "tests/unit/test_evidence.py::test_v2_snapshot_rejects_mutation_of_bound_verification_facts",
      "expected_outcome": "killed",
      "log_ref": ".ai/tasks/TASK-0032/logs/MUTRUN-20260901T131900Z-deba91f69e4d39c5/targeted-mutation/logs/MUT-V2-005.json",
      "log_sha256": "136fc4f377ddde2eddb25e354d47f3562d17eb0519634184593d6862ec6c0557",
      "mutant_exit_code": 1,
      "mutation_id": "MUT-V2-005",
      "operator": "ignore_snapshot_mismatch",
      "outcome": "killed",
      "reason_code": null,
      "safeguard_id": "V2_SNAPSHOT_BINDS_VERIFICATION_FACTS",
      "target": "src/aiflow/evidence.py",
      "target_symbol": "validate_v2_snapshot",
      "timed_out": false
    }
  ],
  "run_reason_code": null,
  "runner_source_sha256": "029ef6707c58138f488af0bb8d40df3e0469b63ec85b641b7b5273bb5790894e",
  "schema_version": "1.0",
  "spec_sha256": "d7d2a22a988e5ecd34ccc30241baf79913eb491ce2cfcba4073ac042bae481f0",
  "subject_commit": "7a27dd9dda01062f97080d549b31f692bd5214d8",
  "task_id": "TASK-0032",
  "uncovered_mutation_ids": []
}
